SOARB,,Solidago arguta Aiton var. boottii (Hook.) Palmer & Steyerm.,Boott's goldenrod,Asteraceae
SOARB,SOARB2,Solidago arguta Aiton ssp. boottii (Hook.) G. Morton,,Asteraceae
SOARB,SOBO,Solidago boottii Hook.,,Asteraceae
SOARB,SODI4,Solidago dispersa Small,,Asteraceae
SOARC,,Solidago arguta Aiton var. caroliniana A. Gray,Atlantic goldenrod,Asteraceae
SOARC,SOARC2,Solidago arguta Aiton ssp. caroliniana (A. Gray) G. Morton,,Asteraceae
SOARC,SOARP,Solidago arguta Aiton ssp. pseudoyadkinensis G. Morton,,Asteraceae
SOARC,SOBOC,Solidago boottii Hook. var. caroliniana (A. Gray) Cronquist,,Asteraceae
SOARC,SOYA,Solidago yadkinensis (Porter) Small,,Asteraceae
SOARN,,Solidago arguta Aiton var. neurolepis (Fernald) Steyerm.,Atlantic goldenrod,Asteraceae
SOARN,SONE3,Solidago neurolepis Fernald,,Asteraceae
SOAS,,Sonchus asper (L.) Hill,spiny sowthistle,Asteraceae
SOAS,SOASA2,Sonchus asper (L.) Hill ssp. asper,,Asteraceae
SOAS,SOASG2,Sonchus asper (L.) Hill ssp. glaucescens (Jord.) J. Ball,,Asteraceae
SOAS,SONY2,Sonchus nymanii Tineo & Guss.,,Asteraceae
SOAU2,,Solidago auriculata Shuttlw. ex S.F. Blake,eared goldenrod,Asteraceae
SOAU2,SOAM5,"Solidago amplexicaulis Torr. & A. Gray ex A. Gray, non M. Martens",,Asteraceae
SOAU2,SONO2,Solidago notabilis Mack.,,Asteraceae
SOBI,,Solidago bicolor L.,white goldenrod,Asteraceae
SOBU,,Solidago buckleyi Torr. & A. Gray,Buckley's goldenrod,Asteraceae
SOCA4,,Solidago caesia L.,wreath goldenrod,Asteraceae
SOCA4,SOAX,Solidago axillaris Pursh,,Asteraceae
SOCA4,SOCAA,Solidago caesia L. var. axillaris (Pursh) A. Gray,,Asteraceae
SOCA4,SOCAC,Solidago caesia L. var. caesia,,Asteraceae
SOCA6,,Solidago canadensis L.,Canada goldenrod,Asteraceae
SOCAG,,Solidago canadensis L. var. gilvocanescens Rydb.,shorthair goldenrod,Asteraceae
SOCAG,SOALG,Solidago altissima L. var. gilvocanescens (Rydb.) Semple,,Asteraceae
SOCAG,SOGI2,Solidago gilvocanescens (Rydb.) Smyth,,Asteraceae
SOCAG,SOPR,Solidago pruinosa Greene,,Asteraceae
SOCAH,,Solidago canadensis L. var. hargeri Fernald,Harger's goldenrod,Asteraceae
SOFL2,,Solidago flexicaulis L.,zigzag goldenrod,Asteraceae
SOFL2,SOLA7,Solidago latifolia L.,,Asteraceae
SOGA,,Solidago gattingeri Chapm. ex A. Gray,Gattinger's goldenrod,Asteraceae
SOGI,,Solidago gigantea Aiton,giant goldenrod,Asteraceae
SOGI,ASLAS2,Aster latissimifolius (Mill.) Kuntze var. serotinus Kuntze,,Asteraceae
SOGI,SOGIS2,Solidago gigantea Aiton ssp. serotina (Kuntze) McNeill,,Asteraceae
SOGI,SOGIL,Solidago gigantea Aiton var. leiophylla Fernald,,Asteraceae
SOGI,SOGIP,Solidago gigantea Aiton var. pitcheri (Nutt.) Shinners,,Asteraceae
SOGI,SOGIS,Solidago gigantea Aiton var. serotina (Kuntze) Cronquist,,Asteraceae
SOGI,SOGIS3,Solidago gigantea Aiton var. shinnersii Beaudry,,Asteraceae
SOGI,SOLE6,Solidago ×leiophallax Friesner,,Asteraceae
SOGI,SOPI5,Solidago pitcheri Nutt.,,Asteraceae
SOGI,SOSE10,"Solidago serotina Aiton, non Retz.",,Asteraceae
SOGI,SOSE9,Solidago serotinoides Á. Löve & D. Löve,,Asteraceae
SOHI,,Solidago hispida Muhl. ex Willd.,hairy goldenrod,Asteraceae
SOHIH,,Solidago hispida Muhl. ex Willd. var. hispida,hairy goldenrod,Asteraceae
SOHIH,SOBIC2,Solidago bicolor L. var. concolor Torr. & A. Gray,,Asteraceae
SOHIH,SOBIO,Solidago bicolor L. var. ovalis Farw.,,Asteraceae
SOJU,,Solidago juncea Aiton,early goldenrod,Asteraceae
SOJU,SOJUN,Solidago juncea Aiton var. neobohemica Fernald,,Asteraceae
SOJU,SOJUR,Solidago juncea Aiton var. ramosa Porter & Britton,,Asteraceae
SOLID,,Solidago L.,goldenrod,Asteraceae
SOLIV,,Soliva Ruiz & Pav.,burrweed,Asteraceae
SOLU,,Solidago ludoviciana (A. Gray) Small,Louisiana goldenrod,Asteraceae
SOLU,SOBOL2,Solidago boottii Hook. var. ludoviciana A. Gray,,Asteraceae
SOMI2,,Solidago missouriensis Nutt.,Missouri goldenrod,Asteraceae
SOMIF,,Solidago missouriensis Nutt. var. fasciculata Holz.,Missouri goldenrod,Asteraceae
SOMIF,SOGL4,Solidago glaberrima M. Martens,,Asteraceae
SOMIF,SOGLM,Solidago glaberrima M. Martens var. moritura (Steele) Palmer & Steyerm.,,Asteraceae
SOMIF,SOMIG,Solidago missouriensis Nutt. var. glaberrima (M. Martens) Rosend. & Cronquist,,Asteraceae
SOMU2,,Soliva mutisii Kunth,Mutis' burrweed,Asteraceae
SONCH,,Sonchus L.,sowthistle,Asteraceae
SONE,,Solidago nemoralis Aiton,gray goldenrod,Asteraceae
SONEL,,Solidago nemoralis Aiton var. longipetiolata (Mack. & Bush) Palmer & Steyerm.,gray goldenrod,Asteraceae
SONEL,SODE4,Solidago decemflora DC.,,Asteraceae
SONEL,SOLO,Solidago longipetiolata Mack. & Bush,,Asteraceae
SONEL,SONED,Solidago nemoralis Aiton ssp. decemflora (DC.) Brammall,,Asteraceae
SONEL,SONEL2,Solidago nemoralis Aiton ssp. longipetiolata (Mack. & Bush) G.W. Douglas,,Asteraceae
SONEL,SONED2,Solidago nemoralis Aiton var. decemflora (DC.) Fernald,,Asteraceae
SONEL,SOPU7,Solidago pulcherrima A. Nelson,,Asteraceae
SONEN,,Solidago nemoralis Aiton var. nemoralis,gray goldenrod,Asteraceae
SONEN,SONEH2,Solidago nemoralis Aiton ssp. haleana (Fernald) G.W. Douglas,,Asteraceae
SONEN,SONEH,Solidago nemoralis Aiton var. haleana Fernald,,Asteraceae
SOOD,,Solidago odora Aiton,anisescented goldenrod,Asteraceae
SOODO,,Solidago odora Aiton var. odora,anisescented goldenrod,Asteraceae
SOODO,SOSU5,Solidago suaveolens Schoepf,,Asteraceae
SOOL,,Sonchus oleraceus L.,common sowthistle,Asteraceae
SOOU,,Solidago ouachitensis C.E.S. Taylor & R.J. Taylor,Ouachita Mountain goldenrod,Asteraceae
SOPA2,,Solidago patula Muhl. ex Willd.,roundleaf goldenrod,Asteraceae
SOPAS,,Solidago patula Muhl. ex Willd. var. strictula Torr. & A. Gray,roundleaf goldenrod,Asteraceae
SOPAS,SOARS,Solidago arguta Aiton var. strigosa (Small) Steyerm.,,Asteraceae
SOPAS,SOSA2,Solidago salicina Elliott,,Asteraceae
SOPAS,SOST2,Solidago strigosa Small,,Asteraceae
SOPE,,Solidago petiolaris Aiton,downy ragged goldenrod,Asteraceae
SOPEA,,Solidago petiolaris Aiton var. angusta (Torr. & A. Gray) A. Gray,downy ragged goldenrod,Asteraceae
SOPEA,SOAN,Solidago angusta Torr. & A. Gray,,Asteraceae
SOPEA,SOLI,Solidago lindheimeriana Scheele,,Asteraceae
SOPEA,SOPEW,Solidago petiolaris Aiton var. wardii (Britton) Fernald,,Asteraceae
SOPEA,SOWA2,Solidago wardii Britton,,Asteraceae
SORA,,Solidago radula Nutt.,western rough goldenrod,Asteraceae
SORAL,,Solidago radula Nutt. var. laeta (Greene) Fernald,western rough goldenrod,Asteraceae
SORAR,,Solidago radula Nutt. var. radula,western rough goldenrod,Asteraceae
SORAR,SOPE5,Solidago pendula Small,,Asteraceae
SORAR,SORO4,Solidago rotundifolia DC.,,Asteraceae
SORAR,SOSC5,Solidago scaberrima Torr. & A. Gray,,Asteraceae
SORU2,,Solidago rugosa Mill.,wrinkleleaf goldenrod,Asteraceae
SORUA,,Solidago rugosa Mill. ssp. aspera (Aiton) Cronquist,wrinkleleaf goldenrod,Asteraceae
SORUA,SOAS4,Solidago aspera Aiton,,Asteraceae
SORUA,SOCE,Solidago celtidifolia Small,,Asteraceae
SORUA,SODR,Solidago drummondii Torr. & A. Gray,,Asteraceae
SORUA,SORUC,Solidago rugosa Mill. var. celtidifolia (Small) Fernald,,Asteraceae
SORUR,,Solidago rugosa Mill. ssp. rugosa,wrinkleleaf goldenrod,Asteraceae
SORUR2,,Solidago rugosa Mill. ssp. rugosa var. rugosa,wrinkleleaf goldenrod,Asteraceae
SORUR2,SOSC4,"Solidago scabra Muhl. ex Willd., non Muhl.",,Asteraceae
SOSE2,,Soliva sessilis Ruiz & Pav.,field burrweed,Asteraceae
SOSE2,SODA,Soliva daucifolia Nutt.,,Asteraceae
SOSE2,SOPT,Soliva pterosperma (Juss.) Less.,,Asteraceae
SOSP2,,Solidago speciosa Nutt.,showy goldenrod,Asteraceae
SOSPR,,Solidago speciosa Nutt. var. rigidiuscula Torr. & A. Gray,showy goldenrod,Asteraceae
SOSPR,SORI4,Solidago rigidiuscula (Torr. & A. Gray) Porter,,Asteraceae
SOSPR,SOSPA,Solidago speciosa Nutt. var. angustata Torr. & A. Gray,,Asteraceae
SOSPS4,,Solidago speciosa Nutt. var. speciosa,showy goldenrod,Asteraceae
SOSPS4,SOCO4,Solidago conferta Mill.,,Asteraceae
SOSPS4,SOHA3,Solidago harperi Mack.,,Asteraceae
SOTO2,,Solidago tortifolia Elliott,twistleaf goldenrod,Asteraceae
SOUL2,,Solidago ulmifolia Muhl. ex Willd.,elmleaf goldenrod,Asteraceae
SOULM,,Solidago ulmifolia Muhl. ex Willd. var. microphylla A. Gray,elmleaf goldenrod,Asteraceae
SOULM,SODE2,Solidago delicatula Small,,Asteraceae
SOULM,SOHE4,Solidago helleri Small,,Asteraceae
SOULM,SOMI8,Solidago microphylla (A. Gray) Engelm. ex Small,,Asteraceae
SOULP2,,Solidago ulmifolia Muhl. ex Willd. var. palmeri Cronquist,Palmer's goldenrod,Asteraceae
SOULU2,,Solidago ulmifolia Muhl. ex Willd. var. ulmifolia,elmleaf goldenrod,Asteraceae
SYAN2,,Symphyotrichum anomalum (Engelm.) G.L. Nesom,manyray aster,Asteraceae
SYAN2,ASAN,Aster anomalus Engelm.,,Asteraceae
SYCO4,,Symphyotrichum cordifolium (L.) G.L. Nesom,common blue wood aster,Asteraceae
SYCO4,ASCO4,Aster cordifolius L.,,Asteraceae
SYCO4,ASCOS5,Aster cordifolius L. ssp. sagittifolius (Wedemeyer ex Willd.) A.G. Jones,,Asteraceae
SYCO4,ASCOF2,Aster cordifolius L. var. furbishiae Fernald,,Asteraceae
SYCO4,ASCOI,Aster cordifolius L. var. incisus Britton,,Asteraceae
SYCO4,ASCOL3,Aster cordifolius L. var. lanceolatus Porter,,Asteraceae
SYCO4,ASCOM3,Aster cordifolius L. var. moratus (Shinners) Shinners,,Asteraceae
SYCO4,ASCOP2,Aster cordifolius L. var. polycephalus Porter,,Asteraceae
SYCO4,ASCOR,Aster cordifolius L. var. racemiflorus Fernald,,Asteraceae
SYCO4,ASCOS3,Aster cordifolius L. var. sagittifolius (Wedemeyer ex Willd.) A.G. Jones,,Asteraceae
SYCO4,ASFIM,Aster finkii Rydb. var. moratus Shinners,,Asteraceae
SYCO4,ASLOI,Aster lowrieanus Porter var. incisus (Britton) Porter,,Asteraceae
SYCO4,ASLOL,Aster lowrieanus Porter var. lanceolatus Porter,,Asteraceae
SYCO4,ASPL6,Aster plumarius Burgess,,Asteraceae
SYCO4,ASSA,Aster sagittifolius Wedemeyer ex Willd.,,Asteraceae
SYCO4,SYCOF,Symphyotrichum cordifolium (L.) G.L. Nesom var. furbishiae (Fernald) G.L. Nesom,,Asteraceae
SYCO4,SYCOL,Symphyotrichum cordifolium (L.) G.L. Nesom var. lanceolatum (Porter) G.L. Nesom,,Asteraceae
SYCO4,SYCOM,Symphyotrichum cordifolium (L.) G.L. Nesom var. moratum (Shinners) G.L. Nesom,,Asteraceae
SYCO4,SYCOP,Symphyotrichum cordifolium (L.) G.L. Nesom var. polycephalum (Porter) G.L. Nesom,,Asteraceae
SYCO4,SYCOR,Symphyotrichum cordifolium (L.) G.L. Nesom var. racemiflorum (Fernald) G.L. Nesom,,Asteraceae
SYCO4,SYSA4,Symphyotrichum sagittifolium (Wedemeyer ex Willd.) G.L. Nesom,,Asteraceae
SYDI2,,Symphyotrichum divaricatum (Nutt.) G.L. Nesom,southern annual saltmarsh aster,Asteraceae
SYDI2,ASDI17,"Aster divaricatus (Nutt.) Torr. & A. Gray, non L.",,Asteraceae
SYDI2,ASEX5,"Aster exilis Elliott, nom. dub.",,Asteraceae
SYDI2,ASNE8,Aster neomexicanus Wooton & Standl.,,Asteraceae
SYDI2,ASSUL,Aster subulatus Michx. var. ligulatus Shinners,,Asteraceae
SYDR,,Symphyotrichum drummondii (Lindl.) G.L. Nesom,Drummond's aster,Asteraceae
SYDRD,,Symphyotrichum drummondii (Lindl.) G.L. Nesom var. drummondii,Drummond's aster,Asteraceae
SYDRD,ASDR,Aster drummondii Lindl.,,Asteraceae
SYDRD,ASSAD2,Aster sagittifolius Wedemeyer ex Willd. var. drummondii (Lindl.) Shinners,,Asteraceae
SYDRT,,Symphyotrichum drummondii (Lindl.) G.L. Nesom var. texanum (Burgess) G.L. Nesom,Drummond's aster,Asteraceae
SYDRT,ASDRP2,Aster drummondii Lindl. ssp. parviceps (Shinners) A.G. Jones,,Asteraceae
SYDRT,ASDRT2,Aster drummondii Lindl. ssp. texanus (Burgess) A.G. Jones,,Asteraceae
SYDRT,ASDRP,Aster drummondii Lindl. var. parviceps (Shinners) A.G. Jones,,Asteraceae
SYDRT,ASDRT,Aster drummondii Lindl. var. texanus (Burgess) A.G. Jones,,Asteraceae
SYDRT,ASTE3,Aster texanus Burgess,,Asteraceae
SYDRT,ASTEP,Aster texanus Burgess var. parviceps Shinners,,Asteraceae
SYDRT,SYDRP,Symphyotrichum drummondii (Lindl.) G.L. Nesom var. parviceps (Shinners) G.L. Nesom,,Asteraceae
SYDU2,,Symphyotrichum dumosum (L.) G.L. Nesom,rice button aster,Asteraceae
SYDUD2,,Symphyotrichum dumosum (L.) G.L. Nesom var. dumosum,rice button aster,Asteraceae
SYDUD2,ASCO38,Aster coridifolius Michx.,,Asteraceae
SYDUD2,ASDU,Aster dumosus L.,,Asteraceae
SYDUD2,ASDUC,Aster dumosus L. var. coridifolius (Michx.) Torr. & A. Gray,,Asteraceae
SYDUD2,ASDUG2,Aster dumosus L. var. gracilentus Torr. & A. Gray,,Asteraceae
SYER,,Symphyotrichum ericoides (L.) G.L. Nesom,white heath aster,Asteraceae
SYERE,,Symphyotrichum ericoides (L.) G.L. Nesom var. ericoides,white heath aster,Asteraceae
SYERE,ASER3,Aster ericoides L.,,Asteraceae
SYERE,ASERE,Aster ericoides L. var. ericoides,,Asteraceae
SYERE,ASERP,Aster ericoides L. var. prostratus (Kuntze) S.F. Blake,,Asteraceae
SYERE,ASEX6,Aster exiguus (Fernald) Rydb.,,Asteraceae
SYERE,ASMU5,Aster multiflorus Aiton,,Asteraceae
SYERE,ASMUE,Aster multiflorus Aiton var. exiguus Fernald,,Asteraceae
SYERE,ASMUP,Aster multiflorus Aiton var. prostratus Kuntze,,Asteraceae
SYERE,ASPO7,Aster polycephalus Rydb.,,Asteraceae
SYERE,LAER3,Lasallea ericoides (L.) Semple & L. Brouillet,,Asteraceae
SYERE,SYERP,Symphyotrichum ericoides (L.) G.L. Nesom var. prostratum (Kuntze) G.L. Nesom,,Asteraceae
SYERE,VIER4,Virgulus ericoides (L.) Reveal & Keener,,Asteraceae
SYLA3,,Symphyotrichum laeve (L.) Á. Löve & D. Löve,smooth blue aster,Asteraceae
SYLA4,,Symphyotrichum lateriflorum (L.) Á. Löve & D. Löve,calico aster,Asteraceae
SYLA6,,Symphyotrichum lanceolatum (Willd.) G.L. Nesom,white panicle aster,Asteraceae
SYLAH5,,Symphyotrichum lateriflorum (L.) Á. Löve & D. Löve var. horizontale (Desf.) G.L. Nesom,calico aster,Asteraceae
SYLAH5,ASHO7,Aster horizontalis Desf.,,Asteraceae
SYLAH5,ASLAH,Aster lateriflorus (L.) Britton var. horizontalis (Desf.) Farw.,,Asteraceae
SYLAH5,ASLAP,Aster lateriflorus (L.) Britton var. pendulus (Aiton) Burgess,,Asteraceae
SYLAH5,ASPE9,Aster pendulus Aiton,,Asteraceae
SYLAI3,,Symphyotrichum lanceolatum (Willd.) G.L. Nesom ssp. lanceolatum var. interior (Wiegand) G.L. Nesom,white panicle aster,Asteraceae
SYLAI3,ASIN18,Aster interior Wiegand,,Asteraceae
SYLAI3,ASLAI3,Aster lanceolatus Willd. ssp. interior (Wiegand) A.G. Jones,,Asteraceae
SYLAI3,ASLAI4,Aster lanceolatus Willd. var. interior (Wiegand) A.G. Jones,,Asteraceae
SYLAI3,ASLAI5,Aster lanceolatus Willd. var. interior (Wiegand) Semple & Chmielewski,,Asteraceae
SYLAI3,ASSII,Aster simplex Willd. var. interior (Wiegand) Cronquist,,Asteraceae
SYLAL3,,Symphyotrichum laeve (L.) Á. Löve & D. Löve var. laeve,smooth blue aster,Asteraceae
SYLAL3,ASFA5,Aster falcidens Burgess,,Asteraceae
SYLAL3,ASLA5,Aster laevis L.,,Asteraceae
SYLAL3,ASLAF2,Aster laevis L. var. falcatus Farw.,,Asteraceae
SYLAL3,ASST18,Aster steeleorum Shinners,,Asteraceae
SYLAL4,,Symphyotrichum lanceolatum (Willd.) G.L. Nesom ssp. lanceolatum var. lanceolatum,white panicle aster,Asteraceae
SYLAL4,ASBE8,Aster bellidiflorus Willd.,,Asteraceae
SYLAL4,ASLA12,Aster lamarckianus Nees,,Asteraceae
SYLAL4,ASLA80,Aster lanceolatus Willd.,,Asteraceae
SYLAL4,ASLAS3,Aster lanceolatus Willd. ssp. simplex (Willd.) A.G. Jones,,Asteraceae
SYLAL4,ASLAS4,Aster lanceolatus Willd. var. simplex (Willd.) A.G. Jones,,Asteraceae
SYLAL4,ASLA17,Aster laxus Willd.,,Asteraceae
SYLAL4,ASPA35,"Aster paniculatus Lam. p.p., non Mill.",,Asteraceae
SYLAL4,ASPAS,Aster paniculatus Lam. var. simplex (Willd.) Burgess,,Asteraceae
SYLAL4,ASSI2,Aster simplex Willd.,,Asteraceae
SYLAL4,ASSIE,Aster simplex Willd. var. estuarinus B. Boivin,,Asteraceae
SYLAL4,ASSIR,Aster simplex Willd. var. ramosissimus (Torr. & A. Gray) Cronquist,,Asteraceae
SYLAL4,ASTER3,Aster tenuifolius L. var. ramosissimus Torr. & A. Gray,,Asteraceae
SYLAL4,SYSI2,Symphyotrichum simplex (Willd.) Á. Löve & D. Löve,,Asteraceae
SYLAL5,,Symphyotrichum lanceolatum (Willd.) G.L. Nesom ssp. lanceolatum var. latifolium (Semple & Chmielewski) G.L. Nesom,white panicle aster,Asteraceae
SYLAL5,ASLAL5,Aster lanceolatus Willd. var. latifolius Semple & Chmielewski,,Asteraceae
SYLAL6,,Symphyotrichum lanceolatum (Willd.) G.L. Nesom ssp. lanceolatum,white panicle aster,Asteraceae
SYLAL7,,Symphyotrichum lateriflorum (L.) Á. Löve & D. Löve var. lateriflorum,calico aster,Asteraceae
SYLAL7,ASHI4,Aster hirsuticaulis Lindl. ex DC.,,Asteraceae
SYLAL7,ASLA6,Aster lateriflorus (L.) Britton,,Asteraceae
SYLAL7,ASLAH3,Aster lateriflorus (L.) Britton var. hirsuticaulis (Lindl. ex DC.) Porter,,Asteraceae
SYLAL7,ASVI16,Aster vimineus Lam.,,Asteraceae
SYLAL7,SOLA5,Solidago lateriflora L.,,Asteraceae
SYLAL7,SYLAH4,Symphyotrichum lateriflorum (L.) Á. Löve & D. Löve var. hirsuticaule (Lindl. ex DC.) G.L. Nesom,,Asteraceae
SYLAP,,Symphyotrichum laeve (L.) Á. Löve & D. Löve var. purpuratum (Nees) G.L. Nesom,smooth blue aster,Asteraceae
SYLAP,ASAT3,Aster attenuatus auct. non Lindl. ex Hook.,,Asteraceae
SYLAP,ASLAP2,Aster laevis L. var. purpuratus (Nees) A.G. Jones,,Asteraceae
SYLAP,ASPU11,Aster purpuratus Nees,,Asteraceae
SYLAP,ASVI13,"Aster virgatus Elliott, non Moench",,Asteraceae
SYMPH4,,Symphyotrichum Nees,aster,Asteraceae
SYNO2,,Symphyotrichum novae-angliae (L.) G.L. Nesom,New England aster,Asteraceae
SYNO2,ASNO,Aster novae-angliae L.,,Asteraceae
SYNO2,LANO,Lasallea novae-angliae (L.) Semple & L. Brouillet,,Asteraceae
SYNO2,VINO5,Virgulus novae-angliae (L.) Reveal & Keener,,Asteraceae
SYOB,,Symphyotrichum oblongifolium (Nutt.) G.L. Nesom,aromatic aster,Asteraceae
SYOB,ASKU,Aster kumleinii Fr. ex A. Gray,,Asteraceae
SYOB,ASOB2,Aster oblongifolius Nutt.,,Asteraceae
SYOB,ASOBA,Aster oblongifolius Nutt. var. angustatus Shinners,,Asteraceae
SYOB,ASOBO,Aster oblongifolius Nutt. var. orientis Shinners,,Asteraceae
SYOB,ASOBR,Aster oblongifolius Nutt. var. rigidulus A. Gray,,Asteraceae
SYOB,LAOB,Lasallea oblongifolia (Nutt.) Semple & L. Brouillet,,Asteraceae
SYOB,VIOB5,Virgulus oblongifolius (Nutt.) Reveal & Keener,,Asteraceae
SYON2,,Symphyotrichum ontarionis (Wiegand) G.L. Nesom,bottomland aster,Asteraceae
SYON2,ASDIT,Aster diffusus Aiton var. thyrsoides A. Gray,,Asteraceae
SYON2,ASLAT,Aster lateriflorus (L.) Britton var. thyrsoides (A. Gray) Sheldon,,Asteraceae
SYON2,ASMI14,"Aster missouriensis Britton, non Kuntze",,Asteraceae
SYON2,ASMIT2,Aster missouriensis Britton var. thyrsoides (A. Gray) Wiegand,,Asteraceae
SYON2,ASON,Aster ontarionis Wiegand,,Asteraceae
SYON2,ASONG,Aster ontarionis Wiegand var. glabratus Semple,,Asteraceae
SYON2,ASPA23,Aster pantotrichus S.F. Blake,,Asteraceae
SYON2,ASPAT,Aster pantotrichus S.F. Blake var. thyrsoides (A. Gray) S.F. Blake,,Asteraceae
SYON2,ASTRT3,Aster tradescantii L. var. thyrsoides (A. Gray) B. Boivin,,Asteraceae
SYON2,SYON,"Symphyotrichum ontarione (Wiegand) G.L. Nesom, orth. var.",,Asteraceae
SYON2,SYONG,"Symphyotrichum ontarione (Wiegand) G.L. Nesom var. glabratum (Semple) L. Brouillet & Bouchard, orth. var.",,Asteraceae
SYON2,SYONG2,Symphyotrichum ontarionis (Wiegand) G.L. Nesom var. glabratum (Semple) L. Brouillet & Bouchard,,Asteraceae
SYOO,,Symphyotrichum oolentangiense (Riddell) G.L. Nesom,skyblue aster,Asteraceae
SYOOO,,Symphyotrichum oolentangiense (Riddell) G.L. Nesom var. oolentangiense,skyblue aster,Asteraceae
SYOOO,ASAZ,Aster azureus Lindl.,,Asteraceae
SYOOO,ASOO4,Aster oolentangiensis Riddell,,Asteraceae
SYOOO,ASOOL2,Aster oolentangiensis Riddell var. laevicaulis (Fernald) A.G. Jones,,Asteraceae
SYOOP,,Symphyotrichum oolentangiense (Riddell) G.L. Nesom var. poaceum (Burgess) G.L. Nesom,skyblue aster,Asteraceae
SYOOP,ASAZP,Aster azureus Lindl. var. poaceus (Burgess) Fernald,,Asteraceae
SYOOP,ASOOP,Aster oolentangiensis Riddell var. poaceus (Burgess) A.G. Jones,,Asteraceae
SYOOP,ASPO8,Aster poaceus Burgess,,Asteraceae
SYOOP,ASVE4,Aster vernalis Engelm. ex Burgess,,Asteraceae
SYPA10,,Symphyotrichum parviceps (Burgess) G.L. Nesom,smallhead aster,Asteraceae
SYPA10,ASDEP2,Aster depauperatus Fernald var. parviceps (Burgess) Fernald,,Asteraceae
SYPA10,ASERP5,Aster ericoides sensu Aiton var. parviceps Burgess,,Asteraceae
SYPA10,ASPA4,Aster parviceps (Burgess) Mack. & Bush,,Asteraceae
SYPA10,ASPIP6,Aster pilosus Willd. ssp. parviceps (Burgess) A.G. Jones,,Asteraceae
SYPA11,,Symphyotrichum patens (Aiton) G.L. Nesom,late purple aster,Asteraceae
SYPA11,SYPAT,Symphyotrichum patens (Aiton) G.L. Nesom var. terranigrum J.J.N. Campb. & W.R. Seymour,,Asteraceae
SYPAG,,Symphyotrichum patens (Aiton) G.L. Nesom var. gracile (Hook.) G.L. Nesom,late purple aster,Asteraceae
SYPAG,ASPAG2,Aster patens Aiton var. gracilis Hook.,,Asteraceae
SYPAG,ASTE12,Aster tenuicaulis (C. Mohr) Burgess,,Asteraceae
SYPAG,VIPAG2,Virgulus patens (Aiton) Reveal & Keener var. gracilis (Hook.) Reveal & Keener,,Asteraceae
SYPAP,,Symphyotrichum patens (Aiton) G.L. Nesom var. patentissimum (Lindl. ex DC.) G.L. Nesom,late purple aster,Asteraceae
SYPAP,ASCO25,Aster continuus Small,,Asteraceae
SYPAP,ASPAP,Aster patens Aiton var. patentissimus (Lindl. ex DC.) Torr. & A. Gray,,Asteraceae
SYPAP,ASPA24,Aster patentissimus Lindl. ex DC.,,Asteraceae
SYPAP,ASSU17,Aster subsessilis Burgess,,Asteraceae
SYPAP,VIPAP3,Virgulus patens (Aiton) Reveal & Keener var. patentissimus (Lindl. ex DC.) Reveal & Keener,,Asteraceae
SYPAP2,,Symphyotrichum patens (Aiton) G.L. Nesom var. patens,late purple aster,Asteraceae
SYPAP2,ASPA5,Aster patens Aiton,,Asteraceae
SYPAP2,LAPA8,Lasallea patens (Aiton) Semple & L. Brouillet,,Asteraceae
SYPAP2,VIPA10,Virgulus patens (Aiton) Reveal & Keener,,Asteraceae
SYPI2,,Symphyotrichum pilosum (Willd.) G.L. Nesom,hairy white oldfield aster,Asteraceae
SYPIP3,,Symphyotrichum pilosum (Willd.) G.L. Nesom var. pilosum,hairy white oldfield aster,Asteraceae
SYPIP3,ASERP4,Aster ericoides sensu Aiton var. platyphyllus Torr. & A. Gray,,Asteraceae
SYPIP3,ASERV,Aster ericoides sensu Aiton var. villosus (Michx.) Torr. & A. Gray,,Asteraceae
SYPIP3,ASJU3,Aster juniperinus Burgess,,Asteraceae
SYPIP3,ASPI2,Aster pilosus Willd.,,Asteraceae
SYPIP3,ASPIP7,Aster pilosus Willd. var. platyphyllus (Torr. & A. Gray) S.F. Blake,,Asteraceae
SYPIP3,ASRA10,Aster ramosissimus auct. non Mill.,,Asteraceae
SYPIP3,ASVI15,Aster villosus Michx.,,Asteraceae
SYPR5,,Symphyotrichum praealtum (Poir.) G.L. Nesom,willowleaf aster,Asteraceae
SYPR7,,Symphyotrichum pratense (Raf.) G.L. Nesom,barrens silky aster,Asteraceae
SYPR7,ASPH5,Aster phyllolepis Torr. & A. Gray,,Asteraceae
SYPR7,ASPR3,Aster pratensis Raf.,,Asteraceae
SYPR7,ASSEM,Aster sericeus Vent. var. microphyllus DC.,,Asteraceae
SYPR7,LASEP2,Lasallea sericea (Vent.) Greene ssp. pratensis (Raf.) Semple & L. Brouillet,,Asteraceae
SYPR7,VIPR8,Virgulus pratensis (Raf.) Reveal & Keener,,Asteraceae
SYPRP,,Symphyotrichum praealtum (Poir.) G.L. Nesom var. praealtum,willowleaf aster,Asteraceae
SYPRP,ASCA48,"Aster caerulescens DC., orth. var.",,Asteraceae
SYPRP,ASCO20,Aster coerulescens DC.,,Asteraceae
SYPRP,ASNOL,Aster novi-belgii L. var. litoreus A. Gray,,Asteraceae
SYPRP,ASPR2,Aster praealtus Poir.,,Asteraceae
SYPRP,ASPRC,"Aster praealtus Poir. var. caerulescens (DC.) A.G. Jones, orth. var.",,Asteraceae
SYPRP,ASPRI,Aster praealtus Poir. var. imbricatior Wiegand,,Asteraceae
SYPRP,ASPRP,Aster praealtus Poir. var. praealtus,,Asteraceae
SYPRP,ASPRT,Aster praealtus Poir. var. texicola Wiegand,,Asteraceae
SYPRP,ASSA11,"Aster salicifolius Aiton, non Lam.",,Asteraceae
SYPRP,SYNOL,Symphyotrichum novi-belgii (L.) G.L. Nesom var. litoreum (A. Gray) G.L. Nesom,,Asteraceae
SYPRP,SYPRT,Symphyotrichum praealtum (Poir.) G.L. Nesom var. texicola (Wiegand) G.L. Nesom,,Asteraceae
SYRA5,,Symphyotrichum racemosum (Elliott) G.L. Nesom,smooth white oldfield aster,Asteraceae
SYRA5,ASBR10,"Aster brachypholis Small, nom. inq.",,Asteraceae
SYRA5,ASFR2,"Aster fragilis auct. non Willd., nom. inq.",,Asteraceae
SYRA5,ASFRB,"Aster fragilis Willd. var. brachypholis (Small) A.G. Jones, nom. inq.",,Asteraceae
SYRA5,ASFRS,"Aster fragilis Willd. var. subdumosus (Wiegand) A.G. Jones, nom. inq.",,Asteraceae
SYRA5,ASRA7,Aster racemosus Elliott,,Asteraceae
SYRA5,ASVI5,"Aster vimineus auct. non Lam., nom. inq.",,Asteraceae
SYRA5,ASVIS,"Aster vimineus Lam. var. subdumosus Wiegand, nom. inq.",,Asteraceae
SYRA5,SYRAS,"Symphyotrichum racemosum (Elliott) G.L. Nesom var. subdumosum (Wiegand) G.L. Nesom, nom. inq.",,Asteraceae
SYSE2,,Symphyotrichum sericeum (Vent.) G.L. Nesom,western silver aster,Asteraceae
SYSE2,ASSE2,Aster sericeus Vent.,,Asteraceae
SYSE2,LASE5,Lasallea sericea (Vent.) Greene,,Asteraceae
SYSE2,VISE8,Virgulus sericeus (Vent.) Reveal & Keener,,Asteraceae
SYSH,,Symphyotrichum shortii (Lindl.) G.L. Nesom,Short's aster,Asteraceae
SYSH,ASCA32,Aster camptosorus Small,,Asteraceae
SYSH,ASSH,Aster shortii Lindl.,,Asteraceae
SYSU5,,Symphyotrichum subulatum (Michx.) G.L. Nesom,eastern annual saltmarsh aster,Asteraceae
SYSU5,ASSU5,Aster subulatus Michx.,,Asteraceae
SYSU5,ASSUE,Aster subulatus Michx. var. euroauster Fernald & Grisc.,,Asteraceae
SYSU5,ASSUO,Aster subulatus Michx. var. obtusifolius Fernald,,Asteraceae
SYTU2,,Symphyotrichum turbinellum (Lindl.) G.L. Nesom,smooth violet prairie aster,Asteraceae
SYTU2,ASTU2,Aster turbinellus Lindl.,,Asteraceae
SYUN,,Symphyotrichum undulatum (L.) G.L. Nesom,wavyleaf aster,Asteraceae
SYUN,ASAS8,Aster asperifolius Burgess,,Asteraceae
SYUN,ASCL5,Aster claviger Burgess,,Asteraceae
SYUN,ASCO41,Aster corrigiatus Burgess,,Asteraceae
SYUN,ASDI10,Aster diversifolius Michx.,,Asteraceae
SYUN,ASGR12,Aster gracilescens Burgess,,Asteraceae
SYUN,ASLI10,Aster linguiformis Burgess,,Asteraceae
SYUN,ASLO12,Aster loriformis (Burgess) Burgess,,Asteraceae
SYUN,ASMO12,Aster mohrii Burgess,,Asteraceae
SYUN,ASPR11,Aster proteus Burgess,,Asteraceae
SYUN,ASSY2,Aster sylvestris Burgess,,Asteraceae
SYUN,ASTR15,Aster triangularis (Burgess) Burgess,,Asteraceae
SYUN,ASTR16,Aster truellius Burgess,,Asteraceae
SYUN,ASUN2,Aster undulatus L.,,Asteraceae
SYUN,ASUNA,Aster undulatus L. var. asperulus Alph. Wood,,Asteraceae
SYUN,ASUND,Aster undulatus L. var. diversifolius (Michx.) A. Gray,,Asteraceae
SYUN,ASUNL,Aster undulatus L. var. loriformis Burgess,,Asteraceae
SYUN,ASUNT,Aster undulatus L. var. triangularis Burgess,,Asteraceae
SYUR,,Symphyotrichum urophyllum (Lindl.) G.L. Nesom,white arrowleaf aster,Asteraceae
SYUR,ASHI5,Aster hirtellus Lindl.,,Asteraceae
SYUR,ASSA13,Aster sagittifolius auct. non Wedemeyer ex Willd.,,Asteraceae
SYUR,ASSAU,Aster sagittifolius Wedemeyer ex Willd. var. urophyllus (Lindl.) Burgess,,Asteraceae
SYUR,ASUR2,Aster urophyllus Lindl.,,Asteraceae
TAER,,Tagetes erecta L.,Aztec marigold,Asteraceae
TAER,TAMA2,Tagetes major Gaertn.,,Asteraceae
