CUPEO,,Cucurbita pepo L. var. ovifera (L.) Harz,field pumpkin,Cucurbitaceae
CUPEO,CUOV,Cucurbita ovifera L.,,Cucurbitaceae
CUPEO,CUPEC,Cucurbita pepo L. var. condensa L.H. Bailey,,Cucurbitaceae
CUPEO,CUPEM,Cucurbita pepo L. var. melopepo (L.) Harz,,Cucurbitaceae
CUPEO2,,Cucurbita pepo L. var. ozarkana D. Decker,Ozark melon,Cucurbitaceae
CUSA4,,Cucumis sativus L.,garden cucumber,Cucurbitaceae
ECHIN5,,Echinocystis Torr. & A. Gray,echinocystis,Cucurbitaceae
ECLO,,Echinocystis lobata (Michx.) Torr. & A. Gray,wild cucumber,Cucurbitaceae
ECLO,MILO4,Micrampelis lobata (Michx.) Greene,,Cucurbitaceae
ECLO,SILO8,Sicyos lobata Michx.,,Cucurbitaceae
LAGEN,,Lagenaria Ser.,lagenaria,Cucurbitaceae
LASI,,Lagenaria siceraria (Molina) Standl.,bottle gourd,Cucurbitaceae
LASI,CULA2,Cucurbita lagenaria L.,,Cucurbitaceae
LASI,CUSI,Cucurbita siceraria Molina,,Cucurbitaceae
LASI,LALE5,Lagenaria leucantha Rusby,,Cucurbitaceae
LASI,LAVU2,Lagenaria vulgaris Ser.,,Cucurbitaceae
MELOT,,Melothria L.,melothria,Cucurbitaceae
MEPE3,,Melothria pendula L.,Guadeloupe cucumber,Cucurbitaceae
MEPEP,,Melothria pendula L. var. pendula,Guadeloupe cucumber,Cucurbitaceae
MEPEP,MEGU,Melothria guadalupensis (Spreng.) Cogn.,,Cucurbitaceae
MEPEP,MEPEC2,Melothria pendula L. var. chlorocarpa (Engelm.) Cogn.,,Cucurbitaceae
SIAN,,Sicyos angulatus L.,oneseed bur cucumber,Cucurbitaceae
SICYO,,Sicyos L.,bur cucumber,Cucurbitaceae
JUAS,,Juniperus ashei J. Buchholz,Ashe's juniper,Cupressaceae
JUAS,JUASO,Juniperus ashei J. Buchholz var. ovata R.P. Adams,,Cupressaceae
JUAS,JUOCC,Juniperus occidentalis Hook. var. conjungens Engelm.,,Cupressaceae
JUAS,JUOCT,Juniperus occidentalis Hook. var. texana Vasey,,Cupressaceae
JUAS,JUSA4,"Juniperus sabinoides sensu Sarg., non Nees",,Cupressaceae
JUNIP,,Juniperus L.,juniper,Cupressaceae
JUVI,,Juniperus virginiana L.,eastern redcedar,Cupressaceae
JUVIV,,Juniperus virginiana L. var. virginiana,eastern redcedar,Cupressaceae
JUVIV,JUVIC,Juniperus virginiana L. ssp. crebra (Fernald & Grisc.) A.E. Murray,,Cupressaceae
JUVIV,JUVIC2,Juniperus virginiana L. var. crebra Fernald & Grisc.,,Cupressaceae
JUVIV,SAVI11,Sabina virginiana (L.) Antoine,,Cupressaceae
TADI2,,Taxodium distichum (L.) Rich.,bald cypress,Cupressaceae
TADI2,TADIN,Taxodium distichum (L.) Rich. var. nutans (Aiton) Sweet,,Cupressaceae
TAXOD,,Taxodium Rich.,bald cypress,Cupressaceae
CUCE,,Cuscuta cephalanthi Engelm.,buttonbush dodder,Cuscutaceae
CUCE,GRCE,Grammica cephalanthi (Engelm.) Hadac & Chrtek,,Cuscutaceae
CUCO2,,Cuscuta compacta Juss. ex Choisy,compact dodder,Cuscutaceae
CUCO3,,Cuscuta coryli Engelm.,hazel dodder,Cuscutaceae
CUCO3,GRCO2,Grammica coryli (Engelm.) Hadac & Chrtek,,Cuscutaceae
CUCOC,,Cuscuta compacta Juss. ex Choisy var. compacta,compact dodder,Cuscutaceae
CUCU2,,Cuscuta cuspidata Engelm.,cusp dodder,Cuscutaceae
CUCU2,GRCU3,Grammica cuspidata (Engelm.) Hadac & Chrtek,,Cuscutaceae
CUGL3,,Cuscuta glomerata Choisy,rope dodder,Cuscutaceae
CUGR,,Cuscuta gronovii Willd. ex Schult.,scaldweed,Cuscutaceae
CUGRG,,Cuscuta gronovii Willd. ex Schult. var. gronovii,scaldweed,Cuscutaceae
CUGRG,CUGRL,Cuscuta gronovii Willd. ex Schult. var. latiflora Engelm.,,Cuscutaceae
CUGRG,CUGRS,Cuscuta gronovii Willd. ex Schult. var. saururi (Engelm.) MacMill.,,Cuscutaceae
CUGRG,CUUM2,Cuscuta umbrosa auct. non Bey. ex Hook.,,Cuscutaceae
CUGRG,GRGR3,Grammica gronovii (Willd. ex Schult.) Hadac & Chrtek,,Cuscutaceae
CUGRG,GRUM,Grammica umbrosa auct. non (Bey. ex Hook.) W.A. Weber,,Cuscutaceae
CUIN,,Cuscuta indecora Choisy,bigseed alfalfa dodder,Cuscutaceae
CUINI,,Cuscuta indecora Choisy var. indecora,bigseed alfalfa dodder,Cuscutaceae
CUINI,CUJE,Cuscuta jepsonii Yunck.,,Cuscutaceae
CUINI,GRIN4,Grammica indecora (Choisy) W.A. Weber,,Cuscutaceae
CUINL,,Cuscuta indecora Choisy var. longisepala Yunck.,bigseed dodder,Cuscutaceae
CUINN,,Cuscuta indecora Choisy var. neuropetala (Engelm.) Hitchc.,bigseed dodder,Cuscutaceae
CUINN,GRINN,Grammica indecora (Choisy) W.A. Weber ssp. neuropetala (Engelm.) W.A. Weber,,Cuscutaceae
CUOB,,Cuscuta obtusiflora Kunth,Peruvian dodder,Cuscutaceae
CUOB,CUAU,Cuscuta australis R. Br.,,Cuscutaceae
CUOBG,,Cuscuta obtusiflora Kunth var. glandulosa Engelm.,Peruvian dodder,Cuscutaceae
CUOBG,CUGL7,Cuscuta glandulosa (Engelm.) Small,,Cuscutaceae
CUPE3,,Cuscuta pentagona Engelm.,fiveangled dodder,Cuscutaceae
CUPEP2,,Cuscuta pentagona Engelm. var. pentagona,fiveangled dodder,Cuscutaceae
CUPEP2,CUAR2,Cuscuta arvensis Bey. ex Engelm.,,Cuscutaceae
CUPEP2,CUCA2,Cuscuta campestris Yunck.,,Cuscutaceae
CUPEP2,CUPEC2,Cuscuta pentagona Engelm. var. calycina Engelm.,,Cuscutaceae
CUPEP2,GRCA3,Grammica campestris (Yunck.) Hadac & Chrtek,,Cuscutaceae
CUPEP2,GRPE,Grammica pentagona (Engelm.) W.A. Weber,,Cuscutaceae
CUPO,,Cuscuta polygonorum Engelm.,smartweed dodder,Cuscutaceae
CURO,,Cuscuta rostrata Shuttlw. ex Engelm. & A. Gray,beaked dodder,Cuscutaceae
CUSCU,,Cuscuta L.,dodder,Cuscutaceae
BOLBO,,Bolboschoenus (Asch.) Palla,bulrush,Cyperaceae
BORO5,,Bolboschoenus robustus (Pursh) Soják,sturdy bulrush,Cyperaceae
BORO5,SCRO5,Schoenoplectus robustus (Pursh) M.T. Strong,,Cyperaceae
BORO5,SCMAA,Scirpus maritimus L. var. agonus (Fernald) Beetle,,Cyperaceae
BORO5,SCMAM,Scirpus maritimus L. var. macrostachyus Michx.,,Cyperaceae
BORO5,SCRO,Scirpus robustus Pursh,,Cyperaceae
BUCA2,,Bulbostylis capillaris (L.) Kunth ex C.B. Clarke,densetuft hairsedge,Cyperaceae
BUCAC,,Bulbostylis capillaris (L.) Kunth ex C.B. Clarke ssp. capillaris,densetuft hairsedge,Cyperaceae
BUCAC,BUCAC2,Bulbostylis capillaris (L.) Kunth ex C.B. Clarke var. crebra Fernald,,Cyperaceae
BUCAC,BUCAI,Bulbostylis capillaris (L.) Kunth ex C.B. Clarke var. isopoda Fernald,,Cyperaceae
BUCAC,FICA6,Fimbristylis capillaris (L.) A. Gray,,Cyperaceae
BUCAC,SCCA7,Scirpus capillaris L.,,Cyperaceae
BUCAC,STCA17,Stenophyllus capillaris (L.) Britton,,Cyperaceae
BUCI,,Bulbostylis ciliatifolia (Elliott) Fernald,capillary hairsedge,Cyperaceae
BUCIC2,,Bulbostylis ciliatifolia (Elliott) Fernald var. ciliatifolia,capillary hairsedge,Cyperaceae
BUCIC2,SCCI3,Scirpus ciliatifolius Elliott,,Cyperaceae
BUCIC2,STCI6,Stenophyllus ciliatifolius (Elliott) C. Mohr,,Cyperaceae
BULBO,,Bulbostylis Kunth,hairsedge,Cyperaceae
CAAB5,,Carex abscondita Mack.,thicket sedge,Cyperaceae
CAAB5,CAABG,Carex abscondita Mack. var. glauca (Chapm.) Fernald,,Cyperaceae
CAAB5,CAABR,Carex abscondita Mack. var. rostellata Fernald,,Cyperaceae
CAAB5,CAMA19,Carex magnifolia Mack.,,Cyperaceae
CAAG2,,Carex aggregata Mack.,glomerate sedge,Cyperaceae
CAAG2,CASPA2,Carex sparganioides Muhl. ex Willd. var. aggregata (Mack.) Gleason,,Cyperaceae
CAAL11,,Carex albursina Sheldon,white bear sedge,Cyperaceae
CAAL11,CALAL9,Carex laxiflora Lam. var. latifolia Boott,,Cyperaceae
CAAL25,,Carex albicans Willd. ex Spreng.,whitetinge sedge,Cyperaceae
CAAL3,,Carex alata Torr.,broadwing sedge,Cyperaceae
CAAL5,,Carex albolutescens Schwein.,greenwhite sedge,Cyperaceae
CAALA,,Carex albicans Willd. ex Spreng. var. albicans,whitetinge sedge,Cyperaceae
CAALA,CAAR17,Carex artitecta Mack.,,Cyperaceae
CAALA,CAARS,Carex artitecta Mack. var. subtilirostris F.J. Herm.,,Cyperaceae
CAALA,CAEMM,Carex emmonsii Dewey ex Torr. var. muehlenbergii (A. Gray) J. Rettig,,Cyperaceae
CAALA,CANIM2,Carex nigromarginata Schwein. var. muehlenbergii (A. Gray) Gleason,,Cyperaceae
CAALA,CAVA5,"Carex varia Muhl. ex Willd., non Host",,Cyperaceae
CAALA2,,Carex albicans Willd. ex Spreng. var. australis (L.H. Bailey) J. Rettig,stellate sedge,Cyperaceae
CAALA2,CAEMA,Carex emmonsii Dewey ex Torr. var. australis (L.H. Bailey) J. Rettig,,Cyperaceae
CAALA2,CAPH4,Carex physorhyncha Liebm. ex Steud.,,Cyperaceae
CAALA2,CAVAA,"Carex varia Muhl. ex Willd., non Host var. australis L.H. Bailey",,Cyperaceae
CAAM8,,Carex amphibola Steud.,eastern narrowleaf sedge,Cyperaceae
CAAM8,CAGRA,Carex grisea Wahlenb. var. amphibola (Steud.) Kük.,,Cyperaceae
CAAN6,,Carex annectens (E.P. Bicknell) E.P. Bicknell,yellowfruit sedge,Cyperaceae
CAAN6,CAANA,Carex annectens (E.P.Bicknell) E.P.Bicknell var. annectens,,Cyperaceae
CAAN6,CAANX,Carex annectens (E.P. Bicknell) E.P. Bicknell var. xanthocarpa (Kük.) Wiegand,,Cyperaceae
CAAN6,CABR28,Carex brachyglossa Mack.,,Cyperaceae
CAAN6,CASEA6,Carex setacea Dewey var. ambigua (Barratt) Fernald,,Cyperaceae
CAAR5,,Carex arkansana (L.H. Bailey) L.H. Bailey,Arkansas sedge,Cyperaceae
CAAT4,,Carex atlantica L.H. Bailey,prickly bog sedge,Cyperaceae
CAATA2,,Carex atlantica L.H. Bailey ssp. atlantica,prickly bog sedge,Cyperaceae
CAATA2,CAATI,Carex atlantica L.H. Bailey var. incomperta (E.P. Bicknell) F.J. Herm.,,Cyperaceae
CAATA2,CAECC,Carex echinata Murray var. conferta (Chapm.) L.H. Bailey,,Cyperaceae
CAATA2,CAIN31,Carex incomperta E.P. Bicknell,,Cyperaceae
CAATC,,Carex atlantica L.H. Bailey ssp. capillacea (L.H. Bailey) Reznicek,prickly bog sedge,Cyperaceae
CAATC,CAATC5,Carex atlantica L.H. Bailey var. capillacea (L.H. Bailey) Cronquist,,Cyperaceae
CAATC,CAATC4,"Carex atlantica L.H. Bailey var. capillaceae (L.H. Bailey) Cronquist, database artifact",,Cyperaceae
CAATC,CADE21,Carex delicatula E.P. Bicknell,,Cyperaceae
CAATC,CAHO10,Carex howei Mack.,,Cyperaceae
CAATC,CAHOC,Carex howei Mack. var. capillacea (L.H. Bailey) Fernald,,Cyperaceae
CAATC,CAINC2,Carex interior L.H. Bailey var. capillacea L.H. Bailey,,Cyperaceae
CAATC,CAMO10,Carex mohriana Mack.,,Cyperaceae
CAAU4,,Carex aureolensis Steud.,goldenfruit sedge,Cyperaceae
CAAU4,CAFR11,Carex frankii auct. non Kunth,,Cyperaceae
CAAU6,,Carex austrina (Small) Mack.,southern sedge,Cyperaceae
CAAU6,CAMUA,Carex muehlenbergii Schkuhr ex Willd. var. australis Olney ex L.H. Bailey,,Cyperaceae
CAAU6,CAMUA4,Carex muehlenbergii Schkuhr ex Willd. var. austrina Small,,Cyperaceae
CABA24,,Carex basiantha Steud.,Willdenow's sedge,Cyperaceae
CABA24,CAWIP,Carex willdenowii Schkuhr ex Willd. var. pauciflora Olney ex L.H. Bailey,,Cyperaceae
CABA7,,Carex baileyi Britton,Bailey's sedge,Cyperaceae
CABI3,,Carex bicknellii Britton,Bicknell's sedge,Cyperaceae
CABI3,CABIB,Carex bicknellii Britton var. bicknellii,,Cyperaceae
CABI3,CABRC2,Carex brevior (Dewey) Mack. var. crawei (W. Boott) B. Boivin,,Cyperaceae
CABL,,Carex blanda Dewey,eastern woodland sedge,Cyperaceae
CABL,CALAB4,Carex laxiflora Lam. var. blanda (Dewey) Boott,,Cyperaceae
CABR10,,Carex brevior (Dewey) Mack.,shortbeak sedge,Cyperaceae
CABR10,CAFEB,Carex festucacea Schkuhr ex Willd. var. brevior (Dewey) Fernald,,Cyperaceae
CABR14,,Carex bromoides Schkuhr ex Willd.,brome-like sedge,Cyperaceae
CABRB6,,Carex bromoides Schkuhr ex Willd. ssp. bromoides,brome-like sedge,Cyperaceae
CABRB6,CABRB2,Carex bromoides Schkuhr ex Willd. var. bromoides,,Cyperaceae
CABU4,,Carex bulbostylis Mack.,false hair sedge,Cyperaceae
CABU4,CAAMG,Carex amphibola Steud. var. globosa (L.H. Bailey) L.H. Bailey,,Cyperaceae
CABU5,,Carex bushii Mack.,Bush's sedge,Cyperaceae
CABU5,CACAC12,Carex caroliniana Schwein. var. cuspidata (Dewey) Shinners,,Cyperaceae
CABU6,,Carex buxbaumii Wahlenb.,Buxbaum's sedge,Cyperaceae
CABU7,,Carex bullata Schkuhr ex Willd.,button sedge,Cyperaceae
CACA14,,Carex careyana Torr. ex Dewey,Carey's sedge,Cyperaceae
CACA15,,Carex caroliniana Schwein.,Carolina sedge,Cyperaceae
CACE,,Carex cephalophora Muhl. ex Willd.,oval-leaf sedge,Cyperaceae
CACH3,,Carex cherokeensis Schwein.,Cherokee sedge,Cyperaceae
CACO13,,Carex conjuncta Boott,soft fox sedge,Cyperaceae
CACO22,,Carex corrugata Fernald,prune-fruit sedge,Cyperaceae
CACO7,,Carex communis L.H. Bailey,fibrousroot sedge,Cyperaceae
CACO8,,Carex comosa Boott,longhair sedge,Cyperaceae
CACO9,,Carex complanata Torr. & Hook.,hirsute sedge,Cyperaceae
CACOC4,,Carex communis L.H. Bailey var. communis,fibrousroot sedge,Cyperaceae
CACR3,,Carex crawei Dewey,Crawe's sedge,Cyperaceae
CACR5,,Carex crebriflora Wiegand,coastal plain sedge,Cyperaceae
CACR6,,Carex crinita Lam.,fringed sedge,Cyperaceae
CACR8,,Carex crus-corvi Shuttlw. ex Kunze,ravenfoot sedge,Cyperaceae
CACR8,CABA10,Carex bayardii Fernald,,Cyperaceae
CACRB,,Carex crinita Lam. var. brevicrinis Fernald,fringed sedge,Cyperaceae
CACU26,,"Carex cumberlandensis Naczi, Kral & Bryson",Cumberland sedge,Cyperaceae
CADA,,Carex davisii Schwein. & Torr.,Davis' sedge,Cyperaceae
CADE5,,Carex debilis Michx.,white edge sedge,Cyperaceae
CADE6,,Carex decomposita Muhl.,cypressknee sedge,Cyperaceae
CADED,,Carex debilis Michx. var. debilis,white edge sedge,Cyperaceae
CADEP,,Carex debilis Michx. var. pubera A. Gray,white edge sedge,Cyperaceae
CADEP,CAAL20,Carex allegheniensis Mack.,,Cyperaceae
CADEP,CADEP2,Carex debilis Michx. ssp. pubera (A. Gray) Á. Löve & D. Löve,,Cyperaceae
CADI5,,Carex digitalis Willd.,slender woodland sedge,Cyperaceae
CADID2,,Carex digitalis Willd. var. digitalis,slender woodland sedge,Cyperaceae
CADIF,,Carex digitalis Willd. var. floridana (L.H. Bailey) Naczi & Bryson,slender woodland sedge,Cyperaceae
CADIF,CADIA,Carex digitalis Willd. var. asymmetrica Fernald,,Cyperaceae
CADIF,CALAF2,Carex laxiculmis Schwein. var. floridana L.H. Bailey,,Cyperaceae
CADIM,,Carex digitalis Willd. var. macropoda Fernald,slender woodland sedge,Cyperaceae
CAEB2,,Carex eburnea Boott,bristleleaf sedge,Cyperaceae
CAEM2,,Carex emoryi Dewey,Emory's sedge,Cyperaceae
CAEM2,CASTE4,Carex stricta Lam. var. elongata (Boeckeler) Gleason,,Cyperaceae
CAFE3,,Carex festucacea Schkuhr ex Willd.,fescue sedge,Cyperaceae
CAFI5,,Carex fissa Mack.,hammock sedge,Cyperaceae
CAFIF,,Carex fissa Mack. var. fissa,hammock sedge,Cyperaceae
CAFL3,,Carex flaccosperma Dewey,thinfruit sedge,Cyperaceae
CAFL5,,Carex floridana Schwein.,Florida sedge,Cyperaceae
CAFL5,CANIF,Carex nigromarginata Schwein. var. floridana (Schwein.) Kük.,,Cyperaceae
CAFR3,,Carex frankii Kunth,Frank's sedge,Cyperaceae
CAGI4,,Carex gigantea Rudge,giant sedge,Cyperaceae
CAGL5,,Carex glaucescens Elliott,southern waxy sedge,Cyperaceae
CAGL6,,Carex glaucodea Tuck. ex Olney,blue sedge,Cyperaceae
CAGL6,CAFLG5,Carex flaccosperma Dewey var. glaucodea (Tuck. ex Olney) Kük.,,Cyperaceae
CAGR2,,Carex gracillima Schwein.,graceful sedge,Cyperaceae
CAGR2,CAGRM,Carex gracillima Schwein. var. macerrima Fernald & Wiegand,,Cyperaceae
CAGR24,,Carex grisea Wahlenb.,inflated narrow-leaf sedge,Cyperaceae
CAGR24,CAAMT,Carex amphibola Steud. var. turgida Fernald,,Cyperaceae
CAGR3,,Carex granularis Muhl. ex Willd.,limestone meadow sedge,Cyperaceae
CAGR3,CAGRG,Carex granularis Muhl. ex Willd. var. granularis,,Cyperaceae
CAGR3,CAGRH,Carex granularis Muhl. ex Willd. var. haleana (Olney) Porter,,Cyperaceae
CAGR3,CAGRR,Carex granularis Muhl. ex Willd. var. recta Dewey,,Cyperaceae
CAGR3,CAHA17,Carex haleana Olney,,Cyperaceae
CAGR3,CARE11,Carex rectior Mack.,,Cyperaceae
CAGR3,CASH6,Carex shriveri Britton,,Cyperaceae
CAGR4,,Carex gravida L.H. Bailey,heavy sedge,Cyperaceae
CAGR5,,Carex grayi Carey,Gray's sedge,Cyperaceae
CAGR5,CAAS8,Carex asa-grayi L.H. Bailey,,Cyperaceae
CAGR5,CAGRH2,Carex grayi Carey var. hispidula A. Gray,,Cyperaceae
CAGR8,,Carex gracilescens Steud.,slender looseflower sedge,Cyperaceae
CAGR8,CALAG3,Carex laxiflora Lam. var. gracillima (Boott) Boott ex B.L. Rob. & Fernald,,Cyperaceae
CAGRG2,,Carex gravida L.H. Bailey var. gravida,heavy sedge,Cyperaceae
CAGRL,,Carex gravida L.H. Bailey var. lunelliana (Mack.) F.J. Herm.,heavy sedge,Cyperaceae
CAGRL,CALU15,Carex lunelliana Mack.,,Cyperaceae
CAHI5,,Carex hirtifolia Mack.,pubescent sedge,Cyperaceae
CAHI6,,Carex hirsutella Mack.,fuzzy wuzzy sedge,Cyperaceae
CAHI6,CACOH,Carex complanata Torr. & Hook. var. hirsuta (Willd.) Gleason,,Cyperaceae
CAHI6,CATR16,Carex triceps auct. non Michx.,,Cyperaceae
CAHI8,,Carex hitchcockiana Dewey,Hitchcock's sedge,Cyperaceae
CAHY2,,Carex hyalina Boott,tissue sedge,Cyperaceae
CAHY3,,Carex hyalinolepis Steud.,shoreline sedge,Cyperaceae
CAHY3,CAIM3,Carex impressa (S.H. Wright) Mack.,,Cyperaceae
CAHY3,CALAL8,Carex lacustris Willd. var. laxiflora Dewey,,Cyperaceae
CAHY3,CARI7,Carex riparia auct. non M.A. Curtis,,Cyperaceae
CAHY3,CARII,Carex riparia M.A. Curtis var. impressa S.H. Wright,,Cyperaceae
CAHY4,,Carex hystericina Muhl. ex Willd.,bottlebrush sedge,Cyperaceae
CAIN11,,Carex interior L.H. Bailey,inland sedge,Cyperaceae
CAIN11,CAINC3,Carex interior L.H. Bailey ssp. charlestonensis Clokey,,Cyperaceae
CAIN11,CAINK,Carex interior L.H. Bailey var. keweenawensis F.J. Herm.,,Cyperaceae
CAIN12,,Carex intumescens Rudge,greater bladder sedge,Cyperaceae
CAIN12,CAINF,Carex intumescens Rudge var. fernaldii L.H. Bailey,,Cyperaceae
CAJA2,,Carex jamesii Schwein.,James' sedge,Cyperaceae
CAJA2,CAST61,Carex steudelii Kunth,,Cyperaceae
CAJO2,,Carex joorii L.H. Bailey,cypress swamp sedge,Cyperaceae
CAKR5,,Carex kraliana Naczi & Bryson,Kral's sedge,Cyperaceae
CALA14,,Carex laevivaginata (Kük.) Mack.,smoothsheath sedge,Cyperaceae
CALA14,CASTL,Carex stipata Muhl. ex Willd. var. laevivaginata Kük.,,Cyperaceae
CALA18,,Carex laxiculmis Schwein.,spreading sedge,Cyperaceae
CALA19,,Carex laxiflora Lam.,broad looseflower sedge,Cyperaceae
CALA31,,Carex latebracteata Waterf.,Waterfall's sedge,Cyperaceae
CALAC,,Carex laxiculmis Schwein. var. copulata (L.H. Bailey) Fernald,spreading sedge,Cyperaceae
CALAC,CACO53,Carex ×copulata (L.H. Bailey) Mack.,,Cyperaceae
CALAL4,,Carex laxiculmis Schwein. var. laxiculmis,spreading sedge,Cyperaceae
CALAL4,CAAB15,Carex absconditiformis Fernald,,Cyperaceae
CALAL4,CAAB6,"Carex ×absconditiformis Fernald, database artifact",,Cyperaceae
CALAL5,,Carex laxiflora Lam. var. laxiflora,broad looseflower sedge,Cyperaceae
CALAL5,CAAN17,Carex anceps Muhl.,,Cyperaceae
CALAL5,CALAP2,Carex laxiflora Lam. var. patulifolia (Dewey) Carey,,Cyperaceae
CALAS,,Carex laxiflora Lam. var. serrulata F.J. Herm.,broad looseflower sedge,Cyperaceae
CALE10,,Carex leptalea Wahlenb.,bristlystalked sedge,Cyperaceae
CALE6,,Carex leavenworthii Dewey,Leavenworth's sedge,Cyperaceae
CALE6,CACEA,Carex cephalophora Muhl. ex Willd. var. angustifolia Boott,,Cyperaceae
CALE6,CACEL,Carex cephalophora Muhl. ex Willd. var. leavenworthii (Dewey) Kük.,,Cyperaceae
CALEH,,Carex leptalea Wahlenb. ssp. harperi (Fernald) W. Stone,Harper's sedge,Cyperaceae
CALEH,CAHA19,Carex harperi Fernald,,Cyperaceae
CALEH,CALEH3,Carex leptalea Wahlenb. var. harperi (Fernald) Weath. & Grisc.,,Cyperaceae
CALEL4,,Carex leptalea Wahlenb. ssp. leptalea,bristlystalked sedge,Cyperaceae
CALEL4,CALET,"Carex leptalea Wahlenb. var. tayloris B. Boivin, nom. inq.",,Cyperaceae
CALO5,,Carex longii Mack.,Long's sedge,Cyperaceae
CALO6,,Carex louisianica L.H. Bailey,Louisiana sedge,Cyperaceae
CALU3,,Carex lupuliformis Sartwell ex Dewey,false hop sedge,Cyperaceae
CALU4,,Carex lupulina Muhl. ex Willd.,hop sedge,Cyperaceae
CALU4,CALUP,Carex lupulina Muhl. ex Willd. var. pedunculata A. Gray,,Cyperaceae
CALU4,CAMA18,Carex ×macounii Dewey,,Cyperaceae
CALU5,,Carex lurida Wahlenb.,shallow sedge,Cyperaceae
CAME13,,Carex mesochorea Mack.,midland sedge,Cyperaceae
CAME13,CACEM,Carex cephalophora Muhl. ex Willd. var. mesochorea (Mack.) Gleason,,Cyperaceae
CAME2,,Carex meadii Dewey,Mead's sedge,Cyperaceae
CAME2,CATEM,Carex tetanica Schkuhr var. meadii (Dewey) L.H. Bailey,,Cyperaceae
CAMI5,,Carex microdonta Torr. & Hook.,littletooth sedge,Cyperaceae
CAMI8,,Carex microrhyncha Mack.,littlesnout sedge,Cyperaceae
CAMO11,,Carex molesta Mack. ex Bright,troublesome sedge,Cyperaceae
CAMO35,,Carex molestiformis Reznicek & P. Rothr.,frightful sedge,Cyperaceae
CAMU4,,Carex muehlenbergii Schkuhr ex Willd.,Muhlenberg's sedge,Cyperaceae
CAMU9,,Carex muskingumensis Schwein.,Muskingum sedge,Cyperaceae
CAMUE,,Carex muehlenbergii Schkuhr ex Willd. var. enervis Boott,Muhlenberg's sedge,Cyperaceae
CAMUE,CAPL12,Carex plana Mack.,,Cyperaceae
CAMUM,,Carex muehlenbergii Schkuhr ex Willd. var. muehlenbergii,Muhlenberg's sedge,Cyperaceae
CANI3,,Carex nigromarginata Schwein.,black edge sedge,Cyperaceae
CANO,,Carex normalis Mack.,greater straw sedge,Cyperaceae
CAOK,,Carex oklahomensis Mack.,Oklahoma sedge,Cyperaceae
CAOK,CASTO,Carex stipata Muhl. ex Willd. var. oklahomensis (Mack.) Gleason,,Cyperaceae
CAOL2,,Carex oligocarpa Schkuhr ex Willd.,richwoods sedge,Cyperaceae
CAOP5,,Carex opaca (F.J. Herm.) P. Rothr. & Reznicek,Bicknell's sedge,Cyperaceae
CAOP5,CABIO,Carex bicknellii Britton var. opaca F.J. Herm.,,Cyperaceae
CAOU,,"Carex ouachitana Kral, Manhart & Bryson",Ouachita Mountain sedge,Cyperaceae
CAOX,,Carex oxylepis Torr. & Hook.,sharpscale sedge,Cyperaceae
CAOXO,,Carex oxylepis Torr. & Hook. var. oxylepis,sharpscale sedge,Cyperaceae
CAOXP,,Carex oxylepis Torr. & Hook. var. pubescens J.K. Underw.,sharpscale sedge,Cyperaceae
CAOZ2,,Carex ozarkana P. Rothr. & Reznicek,Ozark sedge,Cyperaceae
CAPE42,,Carex pellita Muhl. ex Willd.,woolly sedge,Cyperaceae
CAPE42,CALA30,Carex lanuginosa auct. non Michx.,,Cyperaceae
CAPE42,CALAL7,Carex lasiocarpa Ehrh. var. latifolia (Boeckeler) Gilly,,Cyperaceae
CAPE6,,Carex pensylvanica Lam.,Pennsylvania sedge,Cyperaceae
CAPE6,CAMA47,Carex marginata Willd.,,Cyperaceae
CAPE6,CAPEG,Carex pensylvanica Lam. var. glumabunda Peck,,Cyperaceae
CAPE6,CAPEM2,Carex pensylvanica Lam. var. marginata (Willd.) Dewey,,Cyperaceae
CAPE6,CAPEV,Carex pensylvanica Lam. var. vespertina L.H. Bailey,,Cyperaceae
CAPE6,CAST24,Carex stolonifera Schwein.,,Cyperaceae
CAPL18,,Carex planispicata Naczi,flat-spiked sedge,Cyperaceae
CAPL18,CAAMR,Carex amphibola Steud. var. rigida (L.H. Bailey) Fernald,,Cyperaceae
CAPL3,,Carex planostachys Kunze,cedar sedge,Cyperaceae
CAPR12,,Carex prasina Wahlenb.,drooping sedge,Cyperaceae
CARA8,,Carex radiata (Wahlenb.) Small,eastern star sedge,Cyperaceae
CARA8,CARAS,Carex radiata (Wahlenb.) Small var. staminata Peck ex Howe,,Cyperaceae
CARA8,CAROM,Carex rosea Schkuhr ex Willd. var. minor Boott,,Cyperaceae
CARA8,CAROR2,Carex rosea Schkuhr ex Willd. var. radiata (Wahlenb.) Dewey,,Cyperaceae
CARA8,CASY4,Carex sylvicola J. Webber & P.W. Ball,,Cyperaceae
CARE17,,Carex reniformis (L.H. Bailey) Small,kidneyshape sedge,Cyperaceae
CARE18,,Carex reznicekii Werier,Reznicek's sedge,Cyperaceae
CARE9,,Carex retroflexa Muhl. ex Willd.,reflexed sedge,Cyperaceae
CAREX,,Carex L.,sedge,Cyperaceae
CARO22,,Carex rosea Schkuhr ex Willd.,rosy sedge,Cyperaceae
CARO22,CACO58,Carex convoluta Mack.,,Cyperaceae
CARO22,CAFL9,Carex flaccidula Steud.,,Cyperaceae
CARO22,CAROP2,Carex rosea Schkuhr ex Willd. var. pusilla Peck & Howe,,Cyperaceae
CASC11,,Carex scoparia Schkuhr ex Willd.,broom sedge,Cyperaceae
CASCS,,Carex scoparia Schkuhr ex Willd. var. scoparia,broom sedge,Cyperaceae
CASCS,CASCC3,Carex scoparia Schkuhr ex Willd. var. condensa Fernald,,Cyperaceae
CASCS,CASCM2,Carex scoparia Schkuhr ex Willd. var. moniliformis Tuck.,,Cyperaceae
CASCS,CATRM2,Carex tribuloides Wahlenb. var. moniliformis (Tuck.) Britton,,Cyperaceae
CASE6,,Carex seorsa Howe,weak stellate sedge,Cyperaceae
CASH2,,Carex shortiana Dewey,Short's sedge,Cyperaceae
CASH8,,Carex shinnersii P. Rothr. & Reznicek,Shinner's sedge,Cyperaceae
CASO,,Carex socialis Mohlenbr. & Schwegm.,low woodland sedge,Cyperaceae
CASP3,,Carex sparganioides Muhl. ex Willd.,bur-reed sedge,Cyperaceae
CASQ2,,Carex squarrosa L.,squarrose sedge,Cyperaceae
CAST17,,Carex striatula Michx.,lined sedge,Cyperaceae
CAST17,CAIG,Carex ignota Dewey,,Cyperaceae
CAST17,CALAA4,Carex laxiflora Lam. var. angustifolia Dewey,,Cyperaceae
CAST8,,Carex stricta Lam.,upright sedge,Cyperaceae
CAST8,CASTS,Carex stricta Lam. var. strictior (Dewey) Carey,,Cyperaceae
CAST8,CAST23,Carex strictior Dewey,,Cyperaceae
CASU5,,Carex suberecta (Olney) Britton,prairie straw sedge,Cyperaceae
CASW,,Carex swanii (Fernald) Mack.,Swan's sedge,Cyperaceae
CASW,CAVIS2,Carex virescens Muhl. ex Willd. var. swanii Fernald,,Cyperaceae
CATE7,,Carex texensis (Torr.) L.H. Bailey,Texas sedge,Cyperaceae
CATE7,CARET,Carex retroflexa Muhl. ex Willd. var. texensis (Torr.) Fernald,,Cyperaceae
CATI6,,Carex timida Naczi & B.A. Ford,sedge,Cyperaceae
CATO4,,Carex torta Boott ex Tuck.,twisted sedge,Cyperaceae
CATR6,,Carex triangularis Boeckeler,eastern fox sedge,Cyperaceae
CATR6,CAVUP,Carex vulpinoidea Michx. var. platycarpa Hall,,Cyperaceae
CATR7,,Carex tribuloides Wahlenb.,blunt broom sedge,Cyperaceae
CATRS2,,Carex tribuloides Wahlenb. var. sangamonensis Clokey,blunt broom sedge,Cyperaceae
CATRT2,,Carex tribuloides Wahlenb. var. tribuloides,blunt broom sedge,Cyperaceae
CATY,,Carex typhina Michx.,cattail sedge,Cyperaceae
CATY,CASQT,Carex squarrosa L. var. typhina (Michx.) Nutt.,,Cyperaceae
CAUM4,,Carex umbellata Schkuhr ex Willd.,parasol sedge,Cyperaceae
CAUM4,CAAB11,Carex abdita E.P. Bicknell,,Cyperaceae
CAVI4,,Carex virescens Muhl. ex Willd.,ribbed sedge,Cyperaceae
CAVI4,CACO47,Carex costata Schwein.,,Cyperaceae
CAVI4,CAVIC,Carex virescens Muhl. ex Willd. var. costata (Schwein.) Dewey,,Cyperaceae
CAVU2,,Carex vulpinoidea Michx.,fox sedge,Cyperaceae
CAVUV,,Carex vulpinoidea Michx. var. vulpinoidea,fox sedge,Cyperaceae
CAVUV,CASE22,Carex setacea Dewey,,Cyperaceae
CAWI2,,Carex willdenowii Schkuhr ex Willd.,Willdenow's sedge,Cyperaceae
CAWI2,CAWIW,Carex willdenowii Schkuhr ex Willd. var. willdenowii,,Cyperaceae
CLADI,,Cladium P. Br.,sawgrass,Cyperaceae
CLMA10,,Cladium mariscus (L.) Pohl,swamp sawgrass,Cyperaceae
CLMAJ,,Cladium mariscus (L.) Pohl ssp. jamaicense (Crantz) Kük.,Jamaica swamp sawgrass,Cyperaceae
CLMAJ,CLJA,Cladium jamaicense Crantz,,Cyperaceae
CLMAJ,CLLE,Cladium leptostachyum Nees & Meyen,,Cyperaceae
CLMAJ,MAJA3,Mariscus jamaicensis (Crantz) Britton,,Cyperaceae
CYAC2,,Cyperus acuminatus Torr. & Hook. ex Torr.,tapertip flatsedge,Cyperaceae
CYBI6,,Cyperus bipartitus Torr.,slender flatsedge,Cyperaceae
CYBI6,CYNIR,Cyperus niger Ruiz & Pav. var. rivularis (Kunth) V.E. Grant,,Cyperaceae
CYBI6,CYRI,Cyperus rivularis Kunth,,Cyperaceae
CYBI6,PYRI2,Pycreus rivularis (Kunth) Palla,,Cyperaceae
CYCO,,Cyperus compressus L.,poorland flatsedge,Cyperaceae
CYCR6,,Cyperus croceus Vahl,Baldwin's flatsedge,Cyperaceae
CYCR6,CYGL3,Cyperus globulosus auct. non Aubl.,,Cyperaceae
CYCR6,CYMU9,Cyperus multiflorus (Britton) Small,,Cyperaceae
CYCR6,MAGL8,Mariscus globulosus auct. non (Aubl.) Urb.,,Cyperaceae
CYCU,,Cyperus cuspidatus Kunth,coastal plain flatsedge,Cyperaceae
